id,name,parkName,lat,lng,lga,tourismRegion,googleQuery,googleQueryUrl,,
tocumwal-r-p-eastern-section-tocumwal-r-p,"Eastern Section, Tocumwal R.P",Tocumwal R.P,-35.826948,145.553702,MOIRA SHIRE,Murray,"Eastern Section, Tocumwal R.P Tocumwal R.P site:parks.vic.gov.au/places-to-see",,,
victoria-falls-h-a-victoria-falls-camp-area-victoria-falls-h-a,"Victoria Falls Camp Area, Victoria Falls H.A",Victoria Falls H.A,-37.09108602,147.4239791,EAST GIPPSLAND SHIRE,Gippsland,"Victoria Falls Camp Area, Victoria Falls H.A Victoria Falls H.A site:parks.vic.gov.au/places-to-see",,,
wyperfeld-national-park-casuarina-campground-wyperfeld-national-park,"Casuarina Campground, Wyperfeld National Park",Wyperfeld National Park,-35.4459062,141.9961614,MILDURA RURAL CITY,Murray,"Casuarina Campground, Wyperfeld National Park Wyperfeld National Park site:parks.vic.gov.au/places-to-see",https://www.parks.vic.gov.au/places-to-see/sites/waratah-flat-campground,,
wyperfeld-national-park-remote-camp-wyperfeld-national-park,"Remote Camp, Wyperfeld National Park",Wyperfeld National Park,-35.47969385,141.9979119,YARRIAMBIACK SHIRE,Grampians,"Remote Camp, Wyperfeld National Park Wyperfeld National Park site:parks.vic.gov.au/places-to-see",https://www.parks.vic.gov.au/places-to-see/parks/wyperfeld-national-park/where-to-stay/other-camping-areas-in-wyperfeld-national-park,,
yarrawonga-r-p-bruces-bend-yarrawonga-r-p,"Bruces Bend, Yarrawonga R.P",Yarrawonga R.P,-35.96707098,145.9404619,,,"Bruces Bend, Yarrawonga R.P Yarrawonga R.P site:parks.vic.gov.au/places-to-see",,,
yarrawonga-r-p-chinamans-bend-yarrawonga-r-p,"Chinamans Bend, Yarrawonga R.P",Yarrawonga R.P,-36.00551515,145.9696732,MOIRA SHIRE,Murray,"Chinamans Bend, Yarrawonga R.P Yarrawonga R.P site:parks.vic.gov.au/places-to-see",,,
yarrawonga-r-p-forges-bend-yarrawonga-r-p,"Forges Bend, Yarrawonga R.P",Yarrawonga R.P,-35.99679709,145.964428,MOIRA SHIRE,Murray,"Forges Bend, Yarrawonga R.P Yarrawonga R.P site:parks.vic.gov.au/places-to-see",,,
yarrawonga-r-p-forges-bend-yarrawonga-r-p-2,"Forges Bend, Yarrawonga R.P",Yarrawonga R.P,-35.9838054,145.9508985,,,"Forges Bend, Yarrawonga R.P Yarrawonga R.P site:parks.vic.gov.au/places-to-see",,,
yarrawonga-r-p-forges-bend-yarrawonga-r-p-3,"Forges Bend, Yarrawonga R.P",Yarrawonga R.P,-35.99297267,145.9548597,MOIRA SHIRE,Murray,"Forges Bend, Yarrawonga R.P Yarrawonga R.P site:parks.vic.gov.au/places-to-see",,,
yarrawonga-r-p-the-common-yarrawonga-r-p,"The Common, Yarrawonga R.P",Yarrawonga R.P,-36.01129311,145.9769327,MOIRA SHIRE,Murray,"The Common, Yarrawonga R.P Yarrawonga R.P site:parks.vic.gov.au/places-to-see",,,